{
  "schema": "qlkg-store-v1",
  "generator": "kgdistiller",
  "paths": {
    "registry": "knowledge/sources.json",
    "identities": "knowledge/identities.json",
    "alignments": "knowledge/alignments.json",
    "graph": "knowledge/graph",
    "documents": "knowledge/documents.jsonl",
    "embedding_manifest": "knowledge/embeddings/manifest.json"
  },
  "documents": {"count": 1, "sha256": "1111111111111111111111111111111111111111111111111111111111111111", "source_snapshot_sha256": "2222222222222222222222222222222222222222222222222222222222222222"},
  "registry_sha256": "3333333333333333333333333333333333333333333333333333333333333333",
  "identity_sha256": "4444444444444444444444444444444444444444444444444444444444444444",
  "alignment_sha256": "5555555555555555555555555555555555555555555555555555555555555555",
  "graph_sha256": "6666666666666666666666666666666666666666666666666666666666666666",
  "embedding_manifest_sha256": "7777777777777777777777777777777777777777777777777777777777777777",
  "knowledge_generation_sha256": "8888888888888888888888888888888888888888888888888888888888888888",
  "embedding_generation_sha256": "9999999999999999999999999999999999999999999999999999999999999999",
  "store_generation_sha256": "aaaaaaaaaaaaaaaaaaaaaaaaaaaaaaaaaaaaaaaaaaaaaaaaaaaaaaaaaaaaaaaa",
  "managed_paths": ["knowledge/sources.json", "knowledge/graph"],
  "store_sha256": "bbbbbbbbbbbbbbbbbbbbbbbbbbbbbbbbbbbbbbbbbbbbbbbbbbbbbbbbbbbbbbbb"
}
